Lead,Overview,Alden sector,Category of the Keyword1,Category of the Keyword2
Saddle Point,"Saddle Point is a supply chain solution provider offering an integrated
cloud-based platform that leverages AI, machine learning, and advanced optimization
algorithms. Their technology enhances visibility, provides real-time insights, and facilitates
end-to-end collaboration.","Automotive, Building Materials, Consumer Goods, Facilities Services, Healthcare, Logistics, Manufacturing, Oil & Energy, Pharmaceuticals, Telecommunications","
Vehicle Load Optimizer, Route Scheduler, Route Optimizer, Demand Planner, Inventory Optimizer, Supply Network Optimizer, Optimized Order Fulfillment, Production Planner and Scheduler, Supply Network Designing, Opti-Ware - WMS, Opti-Port - TMS, Procurement Optimizer, Opti-Buy - Procure2Pay","Demand  Planning & Forecasting, Warehouse  Management, Supply Chain, Logistics Management"
Technofort (Palms),"PALMS enhances visibility with real-time tracking, consolidates data by
integrating with systems, and optimizes warehouse operations through features like guided
picking by using AI, IoT, and cloud computing. It fosters collaboration among stakeholders with
real-time updates and integrated workflows.","Automotive, Building Materials, Consumer Goods, Durables, Ecom, Logistics, Manufacturing, Pharmaceuticals, Real Estate, Telecommunications","Higher Space Utilization, Real-Time Inventory Visibility, Optimized inventory levels & minimized stockouts, Real-time inventory tracking, Streamlined area and stock planning, Inventory visibility across warehouses, Cross Docking Module, Manage complex Kit parts, Cross-Docking and Yard Management","Advanced Analytics & Dashboards, Supply Chain, Logistics Management"
Elixia Tech,,"Chemicals, Consumer Goods, Ecom, Logistics, Manufacturing, Oil & Energy, Pharmaceutical, Pharmaceuticals","
Control tower, end-to-end logistics visibility, real-time vehicle/LTL tracking, vehicle/route optimization, seamless data flow across systems, real-time alerts on OPS/cost slippages, accurate reports/analytics dashboard, freight module, logistics ERP","Advanced Analytics & Dashboards, Supply Chain, Logistics Management"
Qbit,"Transportation management software helps businesses enhance their
shipping operations. It’s part of supply chain management and allows businesses to
automate tasks and save money on shipping. This is especially important for
manufacturing businesses who want to streamline their shipping processes. An online
good TMS platform is a valuable tool that helps them achieve these objectives.","Transportation, Logistics, Supply Chain","Inventory Management, Freight Management, Control Tower and Dashboards, Order Processing, Fulfillment, Routing & Tracking, Reporting and Analytics, Dispatch Planning, Smart Load & Route Optimization, Automated E-Way Bill & Documentation, Integration with ePOD Application, User-friendly Interface",
NEWAGENXT,"NewageNXT uses the latest technology, including multi-factor authentication
and secured API gateways, ensuring robust data security and seamless integration. This helps
in improving efficiency, providing real-time updates and accessibility on the go. Users have seen
an increase in operational efficiency, leading to faster decision-making and improved CX.", Information Technology & Services,"Freight Forwarding Software, Efficient Operation, Ease of Use & Collaboration, Advanced Security, Audit Trace & History, Document Management System, Mobile Apps and Ease of Accessibility, Modern Cloud Platform, Multi-Location Access & Data Privacy, Omni-Channel Capability",
Shipsy,"Shipsy is a logistics and supply chain management platform that
enhances visibility and efficiency, provides predictive analytics, and seamless data
integration. Utilizing technologies like AI, IoT and cloud computing, Shipsy enables
proactive decision-making and optimized operations across the entire supply chain.",Software Development,"Enhanced Visibility and Real-Time Tracking, AI-Driven Carrier Ranking, Optimized Route and Trip Planning, Automated Picking and Workflow, Inventory Visibility and Optimization, Barcode Scanning/Automated Putaway/Digital Proof of Delivery, Efficient Order and Returns Management, First/Mid/Last Mile Solutions & Intelligent Delivery Planning, Multi-Warehouse Management, API & 3PL Integrations",
Brainvire," Brainvire's track and trace service uses AI, IoT sensors, GPS, and
RFID technology. The technology enables instant alerts and data-driven insights,
helping businesses respond promptly to any disruptions and maintain optimal supply
chain performance.",IT Services and IT Consulting,"Advanced Cold Chain Temperature Control, Automated Data and Trend Analysis, Compliance with Regulatory Standards, Comprehensive Logistics Booking System, Customizable Fleet Management Tools, Data-Driven Supply Chain Decisions, End-to-End Transport Management, Enhanced Supply Chain Visibility, Fleet Management with ERP Solutions, Scalable Logistics for Bulk Orders",
Cogoport,"Cogoport excels in strengthening supply partnerships globally. With
a focus on operational excellence and strategic collaboration, Cogoport provides
comprehensive solutions across Ocean Freight, Air Freight, Haulage, and Trucking.","Transportation, Logistics, Supply Chain and Storage","Check Rate Trend, Vessel Schedules, Cargo Insurance, CogoAssured, CogoFx, Cross-Border Logistic, Customs, CFS, and Handling, Door to Door Shipments, Duties & Taxes Calculator, International Air, Ocean: FCL, LCL, Ship Now and Pay Later, Surface: FTL, PTL, Rail, Tracking & Visibility, Trailer & Rail Container Haulage",
Lepton Software," Lepton solutions bring multi-disciplinary knowledge from geospatial and remote
sensing domains. Using the latest technologies AI/ML, Big Data, and industry leading mapping
platforms like Google Maps and Map info, Lepton enhances decision-making with location
based solutions.", IT Services and IT Consulting,"Location & Geo Spatial Intelligence, 360-degree Video Survey, Accelerate Outage Restoration, Advanced Metering Infrastructure (AMI), Cadastral/Parcel Mapping, Comply with Industry Regulations, Customer Service Systems, Data Conversion and Gain Valuable Insights, Geographic Information Systems (GIS), HD Maps Processing and Remote Sensing, LiDAR Data Processing, SCADA (Supervisory Control and Data Acquisition) Systems",
Crest,"Crest brings together cutting-edge technology and deep supply chain
expertise. It is an AI-powered tool that helps in automating demand forecasts, streamlining
inventory, generating insights to help your business expand. It also helps in reduction in
stock-out and cash recovery time.",Utilities Pineville,"Build and Automate Custom S&OP Workflows, Distribution Planning, Demand Planning & Forecasting, Custom Dashboards, Fulfillment from Right Warehouse, Increasing Fill Rate, Reducing Average Inventory Days, Optimizing Inventory Levels, Improving Distribution Cycle, Purchase Order Tracking",
ORMAE,"ORMAE provides customized end-to-end (from algorithm creation to UI/UX
design) solutions for Operations Research(OR) and data problems in areas of operations,
planning, logistics, forecasting and trading. We leverage advanced algorithms and data
techniques to deliver precise solutions to the challenges the client is facing and ensure a
sustained adoption.",Business Consulting and Services,"Facility Location Planning, Supply Chain Planning and Demand Forecasting, Logistics Planning and Network Optimization, What-if Scenario Planning with Revenue Targets, Delivery Optimization with Time Windows, Vehicle & Route Planning, Capacity Planning to Achieve Revenue Targets, Pallets Optimization, Optimal Batching in Pick and Sort, Minimize Picking Times and Optimal Shelving",
Intugine Technologies,"Intugine renders Logistics visibility across multimodal transportation like FTL,
PTL, Ocean, Courier & Rail through multi- faceted solutions like GPS Tracking & SIM. It
provides Control Tower for exception mitigation, automated freight & indent management for
cost-effective logistics, and a unified interface that streamlines operations. Partnered with India’s
National Logistics Policy, it optimizes operational efficiency through utilizing AI & data-driven
approach.","Transportation, Logistics, Supply Chain and Storage","Digital Indenting, In-Plant Tracking & Dock Management, Track & Trace, Control Tower, Smartlock Inventory Tracking, Freight Payments, Driver & Vehicle E-Verification, Reverse Logistics (Devices), IntuParcel, In-Plant Tracking",
Rocket Flyer Technology Pvt. Ltd.,"Transport Management System by RocketFlow leverages AI to optimize
transportation operations. It offers a website, a mobile app for drivers/executives, and a web
admin portal for supervisors and management teams through an Enterprise SAAS Offering.
Easy to use and ability to Scale the Business, Adherence to Documentation and Compliance.","Software Development, IT","Asset Tracking, Cab Management System, Car Rental Software, Compliance Alerts and Notifications, Cost Analysis & Cost Savings, Employee Transport Management System, EV Software and Field Sales Automation Software, Fleet Maintenance Software, Garage and Visitor Management Systems, Inventory Management, Last Mile Delivery Software",
Datalabs India Solutions Private Limited,"fruiSCE Transportation Management AI based algorithms help clients to
manage end-to-end transportation and fleet management requirements. You can enhance load
planning, resource allocation and trips with all options required to track, trace, PoD, expenses
management along with fuel and driver management.",Information Technology & Services,"Advanced Analytics, Real-Time Communication, Balanced Scorecard, Animal Feed, Engineering, fruiSCE, Manufacturing, Pharma ERP, Automated Workflows, Budgeting, Claims Management, Control Tower, Demand Planning, Remote Fleet Management, Global Trade, Improved Vehicle Maintenance, Low Fuel Consumption, Manufacturing Execution, Risk & Compliance, Supply Chain Optimization, Vendor Management and Warehouse Management",
Inciflo,"Inciflo is an IoT enabled cloud-based Inventory and Warehouse Management System. Our
platform empowers businesses with advanced technology to efficiently manage batches and
track the product across the supply chain, from manufacturing - distributors – retailers.",Software Development,"Warehouse & Inventory Management, E-commerce Fulfillment, Shelf Life Tracking, Scan-Based Processes, Advanced Analytics & Customizable Dashboards, Tracks Lifecycle of Products, Smart Inventory Placement, Dispatch and Warranty Control, Reduced Unverifiable Returns from Channels, Reduced Labor Costs",
Inquizity,"A leading SaaS-based platform that provides end-to-end sales & operations
planning, and supply chain automation. Inquizity helps businesses lower inventory carrying
costs by leveraging AI-based demand planning. It enables customers to reduce cost, while
improving margins and boosting sales through real-time tools like the EDIFICE control tower.",,"Procurement Replenish Planning, Demand Planning, Rough Cut Capacity Planning, Available to Promise Module, Production Planning/Scheduling, Network Design, Vehicle Route Planning, Sales & Operations Planning, Inventory/Replenish Planning, Purchase Planning, Demand Planning Algorithms, Vehicle Routing Optimization Algorithms, Real-Time Warehouse Tracking Systems",
